{"schema":"https://debz.dev/schema/native-execution-request-v4","version":4,"execution":{"schema":"https://debz.dev/schema/native-execution-request-v1","version":1,"backend":"native","completion_owner":"caller","install_root":"/srv/root","root_identity_sha256":"1b292ed83668a7231965384ce66f907a5ebd141db7f6f127fe3cad8ef6589b90","root_inode":42,"architecture":"amd64","caller":{"attempt_id":"aaaaaaaaaaaaaaaaaaaaaaaaaaaaaaaaaaaaaaaaaaaaaaaaaaaaaaaaaaaaaaaa","operation":{"package_transaction":"install"},"request_sha256":"0000000000000000000000000000000000000000000000000000000000000000","policy_sha256":"1111111111111111111111111111111111111111111111111111111111111111"},"program":{"request_sha256":"0000000000000000000000000000000000000000000000000000000000000000","solver_policy_sha256":"1111111111111111111111111111111111111111111111111111111111111111","executor_policy_sha256":"0303030303030303030303030303030303030303030303030303030303030303","plan_sha256":"0404040404040404040404040404040404040404040404040404040404040404","authorization_sha256":"d10399f4ed78c139668ad19080e2e94dd2a70c4f646f4c1a9b5ac5449be507a2","program_sha256":"85e18358b9e7329377b3f67661d29a5cb805302b512a762956f6040f3e72d7e8","exact_lock_sha256":"9d3535edadd65511998ac3e2b55707cd65860d4d72445879214eb387645c21eb","artifact_evidence_sha256":"caaae589ca82b557ea944cb981604e10791c02fdb8b8377e6b8853e3a0f9126f","database_generation_sha256":"7171717171717171717171717171717171717171717171717171717171717171","script_policy_sha256":"7025c97cd0a41642097dbdbb11e8cff02a6e6de733b5f7817e8d22a11dcb0593"},"operation":"install","policy":"keep_existing","triggers":false,"defer_triggers":false,"digest_sha256":"85206c838678c4e35b49ad6890aac3446b6cc42f900b42860459b19856e5cbca"},"authority":{"authorization_schema":"https://debz.dev/schema/native-transaction-authorization-v2","authorization_version":2,"program_schema":"https://debz.dev/schema/native-transaction-program-v2","program_version":2,"exact_lock_schema":"https://debz.dev/schema/exact-closure-lock-v3","exact_lock_version":3},"helper":null,"bootstrap":null,"digest_sha256":"607180681d4acfe7f679d5a0ac6db631537a0516bc9e8365df1df53643c3d653"}
